{
  "$schema": "https://json-schema.org/draft/2020-12/schema",
  "$id": "https://cap-spec.org/schemas/core/cap.core.inspection_report.v1.schema.json",
  "title": "CAP-Core Inspection Report v1",
  "type": "object",
  "additionalProperties": false,
  "required": [
    "schema",
    "renderer",
    "status",
    "fixture",
    "objectGraph",
    "capability",
    "bindings",
    "policy",
    "run",
    "evidence",
    "diagnostics"
  ],
  "properties": {
    "schema": { "const": "cap.core.inspection_report.v1" },
    "renderer": { "$ref": "#/$defs/namedVersion" },
    "status": { "type": "string", "minLength": 1 },
    "fixture": {
      "type": "object",
      "additionalProperties": false,
      "required": ["name", "path"],
      "properties": {
        "name": { "type": "string", "minLength": 1 },
        "path": { "type": "string", "minLength": 1 }
      }
    },
    "objectGraph": { "type": "object", "additionalProperties": true },
    "capability": { "type": "object", "additionalProperties": true },
    "bindings": {
      "type": "array",
      "items": { "type": "object", "additionalProperties": true }
    },
    "policy": { "type": "object", "additionalProperties": true },
    "run": { "type": "object", "additionalProperties": true },
    "evidence": { "type": "object", "additionalProperties": true },
    "diagnostics": {
      "type": "object",
      "additionalProperties": false,
      "required": ["ok", "errors", "warnings"],
      "properties": {
        "ok": { "type": "boolean" },
        "errors": {
          "type": "array",
          "items": { "$ref": "#/$defs/diagnostic" }
        },
        "warnings": {
          "type": "array",
          "items": { "$ref": "#/$defs/diagnostic" }
        }
      }
    }
  },
  "$defs": {
    "namedVersion": {
      "type": "object",
      "additionalProperties": false,
      "required": ["name", "version"],
      "properties": {
        "name": { "type": "string", "minLength": 1 },
        "version": { "type": "string", "minLength": 1 }
      }
    },
    "diagnostic": {
      "type": "object",
      "additionalProperties": false,
      "required": ["code", "path", "message"],
      "properties": {
        "code": { "type": "string", "minLength": 1 },
        "path": { "type": "string", "minLength": 1 },
        "message": { "type": "string", "minLength": 1 }
      }
    }
  }
}
